{
  "$id": "https://tdk-landscape.github.io/schema.service.json",
  "$schema": "http://json-schema.org/draft-07/schema#",
  "additionalProperties": true,
  "allOf": [
    {
      "if": {
        "properties": {
          "appType": {
            "const": "backend"
          }
        }
      },
      "then": {
        "properties": {
          "port": {
            "maximum": 5999,
            "minimum": 4000
          }
        },
        "required": [
          "port"
        ]
      }
    },
    {
      "if": {
        "properties": {
          "appType": {
            "const": "frontend"
          }
        }
      },
      "then": {
        "properties": {
          "port": {
            "maximum": 3999,
            "minimum": 3000
          }
        }
      }
    },
    {
      "if": {
        "properties": {
          "appType": {
            "const": "worker"
          }
        }
      },
      "then": {
        "properties": {
          "featuresEnabled": {
            "contains": {
              "const": "nats"
            }
          }
        },
        "required": [
          "featuresEnabled"
        ]
      }
    },
    {
      "if": {
        "properties": {
          "appType": {
            "const": "bring-your-own"
          }
        }
      },
      "then": {
        "properties": {
          "port": {
            "maximum": 5999,
            "minimum": 4000
          }
        },
        "required": [
          "port",
          "healthCheckPath"
        ]
      }
    }
  ],
  "description": "Configuration for TDK Landscape resources. Drives Tilt orchestration, Docker Compose generation, and dependency resolution. Supports both explicit service.json files and synthesis from directory structure.",
  "properties": {
    "$schema": {
      "description": "JSON Schema reference for IDE validation",
      "type": "string"
    },
    "apiBasePath": {
      "default": "/api",
      "description": "Base path for API routes in Traefik.",
      "pattern": "^/[a-z0-9/-]*$",
      "type": "string"
    },
    "appName": {
      "description": "Unique resource identifier. Must match directory name.\nFormat: {stack}-{function}-{type}\nExample: 'user-management-backend'",
      "examples": [
        "user-management-backend",
        "order-planner-frontend"
      ],
      "maxLength": 64,
      "minLength": 3,
      "pattern": "^[a-z][a-z0-9-]*[a-z0-9]$",
      "type": "string"
    },
    "appType": {
      "description": "Resource type determining build strategy:\n• backend - Hono/Express API server\n• frontend - Vite single-page application (React, Vue, Svelte, Preact, Lit, Solid, Qwik or Vanilla TypeScript, see framework)\n• sdk - Shared library package\n• worker - Background job processor\n• migrator - Database migration runner\n• library - Shared code library\n• mcp - Model Context Protocol server (an HTTP service on Bun, run like a backend)\n• bring-your-own - Wrap an existing service. No app scaffold. Needs Dockerfile or --image.",
      "enum": [
        "backend",
        "frontend",
        "sdk",
        "worker",
        "migrator",
        "library",
        "mcp",
        "bring-your-own"
      ],
      "type": "string"
    },
    "backendName": {
      "description": "For frontends: associated backend resource.\nAuto-computed from appName if not specified.",
      "pattern": "^[a-z][a-z0-9-]*-backend$",
      "type": "string"
    },
    "basePath": {
      "description": "Base path for frontend routing on TDK Landscape.localhost. Default is /{stack}s when omitted.",
      "pattern": "^/[a-z0-9/-]*$",
      "type": "string"
    },
    "databaseName": {
      "description": "Override auto-generated DB name.\nDefault: TDK_{stack}",
      "pattern": "^TDK_[a-z_]+$",
      "type": "string"
    },
    "dependencies": {
      "description": "Deprecated. Use 'dependsOn' instead.",
      "deprecated": true,
      "items": {
        "pattern": "^[a-z][a-z0-9-]*$",
        "type": "string"
      },
      "type": "array",
      "uniqueItems": true
    },
    "dockerfile": {
      "default": "autogenerated/Dockerfile.app.autogenerated",
      "description": "Custom Dockerfile path relative to resource directory. Optional for bring-your-own type.",
      "type": "string"
    },
    "exposeViaProxy": {
      "description": "Whether this bring-your-own resource receives a Traefik route. Defaults to true.",
      "type": "boolean"
    },
    "restart": {
      "description": "Docker Compose restart policy for this bring-your-own resource. Use \"no\" or \"on-failure\" for one-shot jobs such as database migrations, so a finished job is not restarted. Defaults to unless-stopped.",
      "enum": [
        "no",
        "on-failure",
        "unless-stopped",
        "always"
      ],
      "type": "string"
    },
    "image": {
      "description": "Docker image name instead of building from Dockerfile. Optional for bring-your-own type.",
      "type": "string"
    },
    "stack": {
      "description": "Technology stack this resource belongs to.\nUsed for:\n• Database naming: TDK_{stack}\n• Traefik routing: /api/{stack}\n• NATS queue: {stack}_backend_svc",
      "type": "string"
    },
    "params": {
      "additionalProperties": {
        "type": "string"
      },
      "description": "Non-secret configuration parameters (BASE_URL, PORT, etc.). Secrets use 'secrets' section below.",
      "type": "object"
    },
    "secrets": {
      "description": "Names of secrets the resource needs. By default each is read from the project .env (gitignored) and injected into the container; with TDK_SECRET_PROVIDER=infisical they are left to Infisical. NO secret values in params/envVars or anywhere in service.json.",
      "properties": {
        "required": {
          "description": "Required secret names. The resource does not start if any is missing from the project .env.",
          "items": {
            "type": "string",
            "pattern": "^[A-Z_][A-Z0-9_]*$"
          },
          "type": "array",
          "uniqueItems": true
        },
        "optional": {
          "description": "Optional secret names. The resource starts with the variable empty when it is missing from the project .env.",
          "items": {
            "type": "string",
            "pattern": "^[A-Z_][A-Z0-9_]*$"
          },
          "type": "array",
          "uniqueItems": true
        }
      },
      "required": [
        "required"
      ],
      "type": "object"
    },
    "featuresEnabled": {
      "description": "Platform features:\n• nats - NATS JetStream eventing\n• prisma - DB ORM & migrations\n• redis - Caching layer\n• infisical - Secrets management\n• vitest - Test framework\n• traefik - Reverse proxy routing\n• websocket - WS support\n• graphql - GraphQL server\n• grpc - gRPC protocol",
      "items": {
        "enum": [
          "nats",
          "prisma",
          "redis",
          "infisical",
          "vitest",
          "traefik",
          "websocket",
          "graphql",
          "grpc"
        ],
        "type": "string"
      },
      "type": "array",
      "uniqueItems": true
    },
    "framework": {
      "description": "Framework provider id. For frontend resources it selects the Vite and TypeScript config (omitted means react, legacy manifests). For backend resources it selects the HTTP framework on the Bun runtime (omitted means hono; not used with a language that owns its runtime, such as python). Valid ids come from the CLI provider registries, which reject unknown ids before writing a resource.",
      "examples": ["react", "vue", "solid"],
      "pattern": "^[a-z][a-z0-9-]*$",
      "type": "string"
    },
    "language": {
      "description": "Backend language provider id used to scaffold and run the service. Only meaningful for backend resources; omitted means bun (legacy manifests). Valid ids come from the CLI provider registry.",
      "examples": ["bun", "python", "go"],
      "pattern": "^[a-z][a-z0-9-]*$",
      "type": "string"
    },
    "healthCheckPath": {
      "default": "/health",
      "description": "HTTP endpoint for health checks. Must return 200 OK.",
      "pattern": "^/[a-z0-9/-]*$",
      "type": "string"
    },
    "dependsOn": {
      "description": "Resource dependencies used for startup ordering and frontend dependency env generation.\nEach entry can be a stack (e.g. 'service') or resource name (e.g. 'user-admin-api').\nResources listed here start before this resource. Used for focus mode, health checks, migration order.",
      "items": {
        "pattern": "^[a-z][a-z0-9-]*$",
        "type": "string"
      },
      "type": "array",
      "uniqueItems": true
    },
    "nats": {
      "description": "Custom NATS configuration. Auto-generated if 'nats' in featuresEnabled.",
      "properties": {
        "queueGroup": {
          "description": "NATS queue group for load balancing",
          "type": "string"
        },
        "subjects": {
          "description": "NATS subjects to subscribe",
          "items": {
            "type": "string"
          },
          "type": "array"
        }
      },
      "type": "object"
    },
    "playwright": {
      "default": false,
      "description": "Generate Playwright config in .autogenerated/playwright.config.autogenerated.ts when true.",
      "type": "boolean"
    },
    "port": {
      "description": "External dev port (internal always 3000).\nAssignments:\n• 4000: user\n• 4001: service\n• 4002: order\n• 4003: team\n• 4004: auth",
      "examples": [
        4000,
        4001,
        4002,
        4003,
        4004
      ],
      "maximum": 9999,
      "minimum": 3000,
      "type": "integer"
    },
    "replicas": {
      "default": 1,
      "description": "Container instances to run.\nCreates separate containers (resource-1, resource-2).\nTraefik load-balances between all replicas.",
      "maximum": 10,
      "minimum": 1,
      "type": "integer"
    },
    "runtime": {
      "default": "bun",
      "description": "Runtime to use for this resource",
      "enum": [
        "node",
        "bun"
      ],
      "type": "string"
    },
    "schemaVersion": {
      "const": 1,
      "description": "Version of the TDK service manifest contract.",
      "type": "integer"
    },
    "sablier": {
      "description": "On-demand scaling: stop this container when idle, wake it on the next request.\nNot recommended for databases or other stateful resources with in-flight writes.\n(Premium - requires TDK_LICENSE_KEY; see hasSablierLicense() in extension-fetch.ts)",
      "properties": {
        "enable": {
          "default": false,
          "description": "Scale this resource to zero when idle",
          "type": "boolean"
        },
        "deferStart": {
          "default": false,
          "description": "Build the image during tdk up, then create and start the container on its first request",
          "type": "boolean"
        },
        "group": {
          "description": "Resources sharing a group wake and sleep together. Defaults to `stack`.",
          "type": "string"
        },
        "sessionDuration": {
          "default": "10m",
          "description": "How long the resource stays up after its last request (Go duration, e.g. \"10m\", \"1h\").",
          "type": "string"
        }
      },
      "type": "object"
    },
    "syncs": {
      "description": "Directories to sync for hot-reload.\nAuto-computed if not specified:\n• backend: ['src', 'prisma']\n• frontend: ['src', 'public']",
      "items": {
        "type": "string"
      },
      "type": "array"
    },
    "smoke": {
      "description": "Post-start check run by `tdk up` through the public proxy URL (not inside the container): write a record, read it back. `tdk up` fails if a step misses. Absent means no smoke check. Workers and resources with exposeViaProxy false are skipped.",
      "type": "object",
      "required": [
        "via",
        "steps"
      ],
      "additionalProperties": false,
      "properties": {
        "via": {
          "const": "proxy",
          "description": "Only `proxy` is supported: the request goes to the URL `tdk up` prints."
        },
        "timeoutSeconds": {
          "type": "number",
          "exclusiveMinimum": 0,
          "default": 60,
          "description": "How long to wait for the route to come up. Connection errors and 404/502/503/504 are retried until then; any other wrong answer fails at once."
        },
        "steps": {
          "type": "array",
          "minItems": 1,
          "items": {
            "type": "object",
            "required": [
              "path"
            ],
            "additionalProperties": false,
            "properties": {
              "name": {
                "type": "string"
              },
              "method": {
                "type": "string",
                "default": "GET"
              },
              "path": {
                "type": "string",
                "pattern": "^/(?!/)",
                "description": "Appended to the service's public base URL. `{{name}}` is replaced by a value saved by an earlier step."
              },
              "body": {
                "description": "JSON request body."
              },
              "expect": {
                "type": "integer",
                "minimum": 100,
                "maximum": 599,
                "default": 200
              },
              "bodyContains": {
                "type": "string"
              },
              "save": {
                "type": "object",
                "additionalProperties": {
                  "type": "string",
                  "pattern": "^\\$\\."
                },
                "description": "Saves response fields for later steps, for example {\"id\": \"$.id\"}."
              }
            }
          }
        }
      }
    },
    "traefik": {
      "description": "Custom Traefik routing. Auto-generated if not specified.",
      "properties": {
        "healthCheck": {
          "description": "Health check path for Traefik",
          "type": "string"
        },
        "host": {
          "description": "Custom hostname (e.g., 'user.backend.{project}.local')",
          "type": "string"
        },
        "pathPrefix": {
          "description": "URL path prefix (e.g., '/api/user')",
          "type": "string"
        }
      },
      "type": "object"
    }
  },
  "required": [
    "appName",
    "appType",
    "stack",
    "schemaVersion"
  ],
  "title": "TDK Landscape Resource Configuration",
  "type": "object"
}
