{
  "$schema": "https://tdk-landscape.github.io/schema.service.json",
  "schemaVersion": 1,
  "appName": "orders-worker",
  "appType": "worker",
  "stack": "shop",
  "port": 4001,
  "featuresEnabled": ["nats"],
  "params": {
    "NATS_URL": "nats://tdk_example_nats:4222"
  },
  "dependsOn": ["orders-api"]
}
